{
  "schemaVersion": 1,
  "asOf": "2026-08-11",
  "status": "public_due_diligence_complete_account_review_gated",
  "purpose": "Test PE-001 Google Cloud Run Jobs against Mythical's protected-cell requirements using current official public evidence, preserve configuration and contractual unknowns, and define a disabled reference blueprint without selecting a provider or creating authority.",
  "candidateId": "PE-001",
  "architectureClassRef": "PR-001",
  "decisionRefs": ["D-014", "D-017"],
  "riskRefs": ["R-007", "R-008", "R-011", "R-012", "R-013"],
  "workflowRefs": ["A-011", "A-016", "A-023", "A-030", "A-031", "A-035", "A-036", "A-037"],
  "authority": {
    "providerSelectionAuthorized": false,
    "accountReviewAuthorized": false,
    "vendorAccountCreationAuthorized": false,
    "termsAcceptanceAuthorized": false,
    "billingAttachmentAuthorized": false,
    "credentialCreationAuthorized": false,
    "runtimeProvisioningAuthorized": false,
    "schedulerActivationAuthorized": false,
    "persistentStoreCreationAuthorized": false,
    "alertDeliveryAuthorized": false,
    "externalActionAuthorized": false,
    "spendAuthorized": false,
    "conversationIsAuthorization": false
  },
  "sourcePolicy": {
    "officialGoogleDocumentationOnly": true,
    "retrievedOn": "2026-08-11",
    "publicCapabilityIsConfigurationEvidence": false,
    "publicTermsAreAcceptedTerms": false,
    "publishedPriceIsExactCompanyCost": false,
    "absenceOfPublicBlockerIsApproval": false,
    "accountEvidenceRequired": true,
    "professionalPrivacySecurityFinanceReviewRequired": true
  },
  "sources": [
    { "id": "GCP-001", "title": "Create Cloud Run jobs", "url": "https://cloud.google.com/run/docs/create-jobs", "supports": ["PC-001", "PC-010"] },
    { "id": "GCP-002", "title": "Cloud Run service identity", "url": "https://docs.cloud.google.com/run/docs/securing/service-identity", "supports": ["PC-002", "PC-009"] },
    { "id": "GCP-003", "title": "Execute jobs on a schedule", "url": "https://docs.cloud.google.com/run/docs/execute/jobs-on-schedule", "supports": ["PC-003"] },
    { "id": "GCP-004", "title": "Direct VPC egress", "url": "https://docs.cloud.google.com/run/docs/configuring/vpc-direct-vpc", "supports": ["PC-004"] },
    { "id": "GCP-005", "title": "Cloud Run container runtime contract", "url": "https://docs.cloud.google.com/run/docs/container-contract", "supports": ["PC-001", "PC-005", "PC-011"] },
    { "id": "GCP-006", "title": "Artifact Registry container concepts", "url": "https://docs.cloud.google.com/artifact-registry/docs/container-concepts", "supports": ["PC-005"] },
    { "id": "GCP-007", "title": "Cloud Storage Bucket Lock", "url": "https://docs.cloud.google.com/storage/docs/bucket-lock", "supports": ["PC-006", "PC-012"] },
    { "id": "GCP-008", "title": "Store log entries", "url": "https://docs.cloud.google.com/logging/docs/store-log-entries", "supports": ["PC-007"] },
    { "id": "GCP-009", "title": "Cloud Logging IAM access control", "url": "https://docs.cloud.google.com/logging/docs/access-control", "supports": ["PC-007"] },
    { "id": "GCP-010", "title": "Cloud Monitoring notification channels", "url": "https://docs.cloud.google.com/monitoring/support/notification-options", "supports": ["PC-008"] },
    { "id": "GCP-011", "title": "Secret Manager audit logging", "url": "https://docs.cloud.google.com/secret-manager/docs/audit-logging", "supports": ["PC-009"] },
    { "id": "GCP-012", "title": "Cancel Cloud Run job executions", "url": "https://docs.cloud.google.com/run/docs/execute/jobs", "supports": ["PC-011", "PC-012"] },
    { "id": "GCP-013", "title": "Disable service accounts", "url": "https://docs.cloud.google.com/iam/docs/service-accounts-disable-enable", "supports": ["PC-011"] },
    { "id": "GCP-014", "title": "Cloud Run locations", "url": "https://docs.cloud.google.com/run/docs/locations", "supports": [] },
    { "id": "GCP-015", "title": "Cloud Data Processing Addendum", "url": "https://cloud.google.com/terms/data-processing-addendum/", "supports": [] },
    { "id": "GCP-016", "title": "Cloud Run pricing", "url": "https://cloud.google.com/run/pricing", "supports": ["PC-010"] },
    { "id": "GCP-017", "title": "Cloud Billing spend cap budgets", "url": "https://docs.cloud.google.com/billing/docs/how-to/budgets-spend-caps", "supports": ["PC-010"] }
  ],
  "publicRequirementAssessments": [
    { "requirementId": "PC-001", "publicEvidenceStatus": "documented_plausible", "sourceRefs": ["GCP-001", "GCP-005"], "finding": "Jobs support explicit task count, parallelism, timeout and retry configuration; the runtime applies CPU and memory limits and terminates timed-out work.", "configurationVerified": false, "testEvidencePresent": false },
    { "requirementId": "PC-002", "publicEvidenceStatus": "documented_plausible", "sourceRefs": ["GCP-002"], "finding": "A user-managed service account can supply short-lived runtime identity without a GOOGLE_APPLICATION_CREDENTIALS key, but Mythical's four identities and IAM policies do not exist.", "configurationVerified": false, "testEvidencePresent": false },
    { "requirementId": "PC-003", "publicEvidenceStatus": "documented_plausible", "sourceRefs": ["GCP-003"], "finding": "Cloud Scheduler can invoke a job through a dedicated service account; no scheduler, cadence, content digest, disable control, or invocation policy is configured.", "configurationVerified": false, "testEvidencePresent": false },
    { "requirementId": "PC-004", "publicEvidenceStatus": "partial_public_evidence", "sourceRefs": ["GCP-004"], "finding": "Direct VPC egress and firewall-tag controls are available, but an independently tested deny-all internet path and explicit future allowlist design remain unproven.", "configurationVerified": false, "testEvidencePresent": false },
    { "requirementId": "PC-005", "publicEvidenceStatus": "documented_plausible", "sourceRefs": ["GCP-005", "GCP-006"], "finding": "Container images can be pinned by immutable SHA-256 digest and the writable filesystem is in-memory and non-persistent; no reviewed Mythical image, digest, provenance, memory-volume limit, or source-mount proof exists.", "configurationVerified": false, "testEvidencePresent": false },
    { "requirementId": "PC-006", "publicEvidenceStatus": "documented_plausible", "sourceRefs": ["GCP-007"], "finding": "Cloud Storage Bucket Lock can prevent object deletion or replacement for a retention period, but its lock is irreversible and no retention, legal, writer/reader, deletion, or project-exit decision exists.", "configurationVerified": false, "testEvidencePresent": false },
    { "requirementId": "PC-007", "publicEvidenceStatus": "documented_plausible", "sourceRefs": ["GCP-008", "GCP-009"], "finding": "Cloud Logging documents encryption, location, retention, IAM, views and field restrictions; Mythical has not configured log exclusion, payload minimization, access, region, retention, key, or deletion controls.", "configurationVerified": false, "testEvidencePresent": false },
    { "requirementId": "PC-008", "publicEvidenceStatus": "partial_public_evidence", "sourceRefs": ["GCP-010"], "finding": "Monitoring supports notification channels and recommends redundancy because several channel types share a failure domain; recipient authentication, two-route design, payload minimization, delivery, failure and deduplication tests remain absent.", "configurationVerified": false, "testEvidencePresent": false },
    { "requirementId": "PC-009", "publicEvidenceStatus": "partial_public_evidence", "sourceRefs": ["GCP-002", "GCP-011"], "finding": "Service identity can avoid static keys and Secret Manager provides auditable access, but Mythical should remain secretless initially and has not reviewed any later credential lifecycle, rotation, revocation, or data-access logging configuration.", "configurationVerified": false, "testEvidencePresent": false },
    { "requirementId": "PC-010", "publicEvidenceStatus": "partial_public_evidence", "sourceRefs": ["GCP-001", "GCP-016", "GCP-017"], "finding": "Job resource/time ceilings and preview Cloud Run spend caps exist, but spend-cap enforcement has reporting latency, permits in-flight completion, excludes persistent-resource costs, and requires billing-level roles; exact all-in cost and a tested hard stop remain unknown.", "configurationVerified": false, "testEvidencePresent": false },
    { "requirementId": "PC-011", "publicEvidenceStatus": "documented_plausible", "sourceRefs": ["GCP-005", "GCP-012", "GCP-013"], "finding": "A job execution can be cancelled while retaining execution evidence and a service account can be disabled; no independent operator, runbook, response time, scheduler disable, active-run kill, identity revoke, or exercise exists.", "configurationVerified": false, "testEvidencePresent": false },
    { "requirementId": "PC-012", "publicEvidenceStatus": "partial_public_evidence", "sourceRefs": ["GCP-007", "GCP-012"], "finding": "Execution records can remain viewable after cancellation and locked objects can protect history, but backup, restore, partial-write, clock-drift, stale-config and replay resistance require Mythical-designed tests.", "configurationVerified": false, "testEvidencePresent": false }
  ],
  "regionalAndPrivacyReview": {
    "irelandCloudRunRegionListed": false,
    "candidateEuropeanRegions": [
      { "region": "europe-west1", "location": "Belgium", "pricingTier": 1 },
      { "region": "europe-west4", "location": "Netherlands", "pricingTier": 1 },
      { "region": "europe-north1", "location": "Finland", "pricingTier": 1 }
    ],
    "selectedRegion": null,
    "jobAssociatedCustomerDataStoredInSelectedRegionDocumented": true,
    "dpaDefinesGoogleAsProcessorWhenApplicable": true,
    "processingOutsideSelectedRegionPossibleSubjectToTerms": true,
    "subprocessorListReferencedByDpa": true,
    "dpaAccepted": false,
    "controllerRoleConfirmed": false,
    "dataTransferAssessmentCompleted": false,
    "privacyReviewCompleted": false,